{"task_id":"T-179","status":"PASSED","files_modified":[{"path":".agent/eval/performance.json","lines_added":34,"lines_removed":0}],"diff_summary":"Scored performance dimension P-1..P-6 honestly from available gates and test evidence.","verification":{"command":"jq -e '([.checks[].id] | sort)==([\"P-1\",\"P-2\",\"P-3\",\"P-4\",\"P-5\",\"P-6\"] | sort)' .agent/eval/performance.json","exit_code":0,"tests_passed":1,"tests_failed":0,"duration_ms":100},"unresolved_blockers":["P-1 Lighthouse tooling not installed (NOT_RUN).","P-2 Web vitals tooling not installed (NOT_RUN).","P-3 per-route JS bundle sizes unverified.","P-4 invariants open with coverage test failures.","P-5 animation frame rate and heap unmeasured.","P-6 full-viewport axe zero violations unproven."]}
