{"task_id": "T-44323", "status": "PASSED", "files_modified": [{"path": "frontend/components/pages/live/telemetry-charts.tsx", "lines_added": 149, "lines_removed": 0}], "diff_summary": "Stage exact selected-driver telemetry chart region, preserving conditionals, labels, props and series.", "verification": {"command": "npm --prefix frontend run typecheck && npm --prefix frontend run lint", "exit_code": 0, "tests_passed": 0, "tests_failed": 0, "duration_ms": 3466}, "unresolved_blockers": []}
