{"task_id": "T-44111", "status": "PASSED", "files_modified": [{"path": "backend/app/main.py", "lines_added": 35, "lines_removed": 27}], "diff_summary": "Composed CRUD and session action SQL with psycopg.sql; used static action SET fragments and reused CRUD 404 checks while preserving action flow.", "verification": {"command": ".venv/bin/ruff check --select S608 backend/app/main.py && .venv/bin/python -c \"import ast,subprocess; p='backend/app/main.py'; s=open(p).read(); n=next(n for n in ast.parse(s).body if isinstance(n,ast.AsyncFunctionDef) and n.name=='session_action'); subprocess.run(['.venv/bin/ruff','check','--select','C901','--stdin-filename',p,'-'],input=ast.get_source_segment(s,n),text=True,check=True)\" && .venv/bin/ruff format --check backend/app/main.py", "exit_code": 0, "tests_passed": 0, "tests_failed": 0, "duration_ms": 200}, "unresolved_blockers": []}
