{"task_id": "T-44380", "status": "PASSED", "files_modified": [{"path": "frontend/app/styles/shell.css", "lines_added": 0, "lines_removed": 3}], "diff_summary": "Restore tested40px feed height at every viewport; keep palette repairs in route layouts.", "verification": {"command": "bash scripts/eval/lint-spacing.sh && bash scripts/eval/lint-motion.sh && bash scripts/eval/lint-banned.sh && bash scripts/eval/lint-neobrutal.sh && npm --prefix frontend run typecheck && npm --prefix frontend run lint -- --max-warnings 0", "exit_code": 0, "tests_passed": 0, "tests_failed": 0, "duration_ms": 4807}, "unresolved_blockers": []}
