{"task_id": "T-44248", "status": "PASSED", "files_modified": [{"path": "frontend/components/shell-feed.tsx", "lines_added": 104, "lines_removed": 0}, {"path": "frontend/app/styles/shell.css", "lines_added": 18, "lines_removed": 3}], "diff_summary": "Add compact truthful polling status/retry and five-state real-data ticker with retained partial data, no empty red band and delayed loading skeleton.", "verification": {"command": "bash scripts/eval/lint-spacing.sh && bash scripts/eval/lint-banned.sh && bash scripts/eval/lint-motion.sh && bash scripts/eval/lint-neobrutal.sh && npm --prefix frontend run typecheck && npm --prefix frontend run lint -- --max-warnings 0", "exit_code": 0, "tests_passed": 0, "tests_failed": 0, "duration_ms": 3300}, "unresolved_blockers": []}
