{"task_id": "T-44214", "status": "PASSED", "files_modified": [{"path": "backend/app/main.py", "lines_added": 2, "lines_removed": 0}], "diff_summary": "Restored explicit Decision/IncidentIn legacy exports after7full-suite failures; all18focused contract/regression cases pass unchanged.", "verification": {"command": "env APP_ENV=local PYTHONPATH=backend .venv/bin/pytest -q backend/tests/test_api.py -k 'incident_decisions_always_return_current_driver_state or unsupported_sanction_fields_are_rejected_with_guidance or unsupported_sanction_zero_and_points_only_decisions_remain_valid' && env APP_ENV=local PYTHONPATH=backend .venv/bin/pytest -q backend/tests/test_contract_snapshot.py backend/tests/test_route_registration.py && .venv/bin/ruff check backend/app/main.py && .venv/bin/ruff format --check backend/app/main.py", "exit_code": 0, "tests_passed": 18, "tests_failed": 0, "duration_ms": 900}, "unresolved_blockers": []}
