{"task_id": "T-44480", "status": "PASSED", "files_modified": [{"path": "frontend/e2e/resource-memberships.spec.ts", "lines_added": 2, "lines_removed": 2}], "diff_summary": "Match exact partial-error HTTP formatting and retry accessible name while preserving retained-data, write-count and recovery assertions.", "verification": {"command": "npm --prefix frontend run typecheck && npm --prefix frontend run lint -- --max-warnings 0 && cd frontend && ./node_modules/.bin/playwright test e2e/resource-memberships.spec.ts --list", "exit_code": 0, "tests_passed": 0, "tests_failed": 0, "duration_ms": 4769}, "unresolved_blockers": []}
