{"task_id": "T-44438", "status": "PASSED", "files_modified": [{"path": "frontend/e2e/resource-flows.spec.ts", "lines_added": 26, "lines_removed": 15}], "diff_summary": "Scope resource journey assertions to main and exact pagination controls; supply the actual zero-metric dashboard contract, preserving every test assertion.", "verification": {"command": "npm --prefix frontend run typecheck && npm --prefix frontend run lint -- --max-warnings 0 && cd frontend && ./node_modules/.bin/playwright test e2e/resource-flows.spec.ts --list", "exit_code": 0, "tests_passed": 0, "tests_failed": 0, "duration_ms": 2600}, "unresolved_blockers": []}
