{"task_id":"T-443","status":"PASSED","files_modified":[{"path":"frontend/e2e/perf-fps.spec.ts","lines_added":8,"lines_removed":2},{"path":"scripts/eval/verify-bundle-size.py","lines_added":11,"lines_removed":3}],"diff_summary":"Typed Performance.memory and Ruff-formatted bundle checker without changing assertions or thresholds.","verification":{"command":".venv/bin/ruff check scripts/eval/verify-bundle-size.py && .venv/bin/ruff format --check scripts/eval/verify-bundle-size.py && npm --prefix frontend run lint -- --max-warnings 0","exit_code":0,"tests_passed":0,"tests_failed":0,"duration_ms":1633,"typecheck_errors":0,"lint_warnings":0},"unresolved_blockers":[]}
