{"task_id": "T-44148", "status": "PASSED", "files_modified": [{"path": "backend/tests/contract_fixture.py", "lines_added": 141, "lines_removed": 0}], "diff_summary": "Updated the disposable fixture to read MONGODB_URL, use PyJWT with a ten-minute token, insert users through the real connection, and close TestClient after capture.", "verification": {"command": ".venv/bin/ruff check backend/tests/contract_fixture.py && .venv/bin/ruff format --check backend/tests/contract_fixture.py && .venv/bin/python -m py_compile backend/tests/contract_fixture.py", "exit_code": 0, "tests_passed": 0, "tests_failed": 0, "duration_ms": 200}, "unresolved_blockers": []}
