{"task_id": "T-44377", "status": "PASSED", "files_modified": [{"path": "backend/app/simulation_runner.py", "lines_added": 103, "lines_removed": 0}], "diff_summary": "Stage exact simulation runner body with explicit dependencies, preserving tick and completion behavior.", "verification": {"command": "env APP_ENV=local PYTHONPATH=backend .venv/bin/pytest -q backend/tests/test_api.py -k \"simulation or contract_routes\" && env APP_ENV=local PYTHONPATH=backend .venv/bin/pytest -q backend/tests/test_contract_snapshot.py && .venv/bin/ruff check backend/app backend/tests && .venv/bin/ruff format --check backend/app/simulation_runner.py", "exit_code": 0, "tests_passed": 16, "tests_failed": 0, "duration_ms": 1791}, "unresolved_blockers": []}
