{"task_id":"T-206","status":"PASSED","files_modified":[{"path":".agent/eval/aesthetic.json","lines_added":2,"lines_removed":2}],"diff_summary":"Recorded A-1 as passed in aesthetic.json based on lint-spacing.sh exiting 0 with zero violations.","verification":{"command":"bash scripts/eval/lint-spacing.sh && bash scripts/eval/lint-banned.sh && bash scripts/eval/lint-motion.sh","exit_code":0,"tests_passed":0,"tests_failed":0,"duration_ms":300},"unresolved_blockers":[]}
