{"task_id": "T-44130", "status": "PASSED", "files_modified": [{"path": ".agent/adr/ADR-011-health-probes.md", "lines_added": 27, "lines_removed": 0}, {"path": ".agent/ARCHITECT.md", "lines_added": 6, "lines_removed": 2}, {"path": "DECISIONS.md", "lines_added": 2, "lines_removed": 0}], "diff_summary": "Recorded additive health ADR011 and early health dependency slice with focused architecture review and lock.", "verification": {"command": "bash scripts/agent/verify-lock.sh && bash scripts/agent/budget.sh", "exit_code": 0, "tests_passed": 0, "tests_failed": 0, "duration_ms": 0}, "unresolved_blockers": []}
