{
  "task_id": "T-160",
  "status": "PASSED",
  "files_modified": [
    { "path": "backend/app/main.py", "lines_added": 3, "lines_removed": 29 },
    { "path": "backend/app/membership_router.py", "lines_added": 50, "lines_removed": 0 }
  ],
  "diff_summary": "Moved four membership handlers into an APIRouter registered at the same point, preserving roles and responses.",
  "verification": {
    "command": "DATABASE_URL=postgresql://apexgrid:apexgrid@localhost:15432/apexgrid MONGODB_URL=mongodb://localhost:27018 MONGODB_DATABASE=apexgrid APP_ENV=local PYTHONPATH=backend .venv/bin/pytest -q backend/tests/test_api.py -k 'membership_route_characterization or contract_routes_are_registered'",
    "exit_code": 0,
    "tests_passed": 2,
    "tests_failed": 0,
    "duration_ms": 710,
    "typecheck_errors": 222,
    "lint_warnings": 543
  },
  "unresolved_blockers": []
}
