{"task_id": "T-44182", "status": "PASSED", "files_modified": [{"path": "scripts/eval/lint-motion.sh", "lines_added": 69, "lines_removed": 7}], "diff_summary": "Integrated CSS motion validator, fixture selftest and explicit file mode while retaining original layout/shadow/all bans.", "verification": {"command": "bash -n scripts/eval/lint-motion.sh && bash scripts/eval/lint-motion.sh --self-test && bash scripts/eval/lint-motion.sh scripts/eval/rules/motion.good.css && ! bash scripts/eval/lint-motion.sh scripts/eval/rules/motion.bad.css", "exit_code": 0, "tests_passed": 1, "tests_failed": 0, "duration_ms": 200}, "unresolved_blockers": []}
