{"task_id":"T-149","status":"PASSED","files_modified":[{"path":"backend/app/main.py","lines_added":4,"lines_removed":1},{"path":"backend/app/demo_race_router.py","lines_added":26,"lines_removed":0}],"diff_summary":"Moved demo race list GET into APIRouter with unchanged auth, pagination and response. Worker socket denial was resolved by orchestrator seeded rerun; Ruff ratchet repaired.","verification":{"command":"DATABASE_URL=postgresql://apexgrid:apexgrid@localhost:15432/apexgrid MONGODB_URL=mongodb://localhost:27018 MONGODB_DATABASE=apexgrid APP_ENV=local PYTHONPATH=backend .venv/bin/pytest -q backend/tests/test_api.py -k generated_demo_race_create_list_and_scoped_delete","exit_code":0,"tests_passed":1,"tests_failed":0,"duration_ms":1405},"unresolved_blockers":[]}
