{"task_id":"T-44558","status":"PASSED","files_modified":[{"path":"backend/app/bootstrap.py","lines_added":2,"lines_removed":2},{"path":"backend/app/core/auth_dependencies.py","lines_added":1,"lines_removed":1},{"path":"backend/app/simulation_pit.py","lines_added":9,"lines_removed":2}],"diff_summary":"Annotated bootstrap.main, typed MongoClient with dict[str, object], converted revocation results to bool, and narrowed car numbers before int conversion while retaining the default and string-number support.","verification":{"command":"env APP_ENV=local PYTHONPATH=backend .venv/bin/pytest -q backend/tests/test_contract_snapshot.py backend/tests/test_request_dependencies.py backend/tests/test_runtime_dependencies.py && .venv/bin/mypy --strict backend/app/bootstrap.py backend/app/core/auth_dependencies.py backend/app/simulation_pit.py && .venv/bin/ruff check backend/app backend/tests && .venv/bin/ruff format --check backend/app/bootstrap.py backend/app/core/auth_dependencies.py backend/app/simulation_pit.py","exit_code":0,"tests_passed":21,"tests_failed":0,"duration_ms":700},"unresolved_blockers":[]}
