{"task_id": "T-44535", "status": "PASSED", "files_modified": [{"path": ".agent/ARCHITECT.md", "lines_added": 10, "lines_removed": 2}, {"path": "DECISIONS.md", "lines_added": 2, "lines_removed": 0}, {"path": ".agent/adr/ADR-013-stewarding-read-models.md", "lines_added": 22, "lines_removed": 0}], "diff_summary": "ADR-013 documents required read-only stewarding contracts, focused Phase C and renewed architecture lock; implementation pending.", "verification": {"command": "bash scripts/agent/verify-lock.sh && bash scripts/agent/budget.sh", "exit_code": 0, "tests_passed": 0, "tests_failed": 0, "duration_ms": 30}, "unresolved_blockers": []}
