{
  "task_id": "T-44627",
  "status": "PASSED",
  "files_modified": [
    {
      "path": "backend/tests/test_showcase_audit.py",
      "lines_added": 173,
      "lines_removed": 0
    }
  ],
  "diff_summary": "Added offline fake-database tests for security metadata rows, empty/error behavior, and authenticated actor context on a steward penalty write.",
  "verification": {
    "command": ".venv/bin/pytest -q -p no:cacheprovider backend/tests/test_showcase_audit.py",
    "exit_code": 0,
    "tests_passed": 4,
    "tests_failed": 0,
    "duration_ms": 260
  },
  "unresolved_blockers": []
}
