{"task_id":"T-198","status":"PASSED","files_modified":[{"path":"scripts/eval/verify-bundle-size.py","lines_added":44,"lines_removed":0}],"diff_summary":"Added verify-bundle-size.py script and verified P-3 (initial JS <= 170 KB gzip across all routes).","verification":{"command":"python3 scripts/eval/verify-bundle-size.py && python3 -c \"import json; d=json.load(open('.agent/eval/performance.json')); assert any(c['id']=='P-3' and c['passed'] for c in d['checks'])\"","exit_code":0,"tests_passed":1,"tests_failed":0,"duration_ms":100},"unresolved_blockers":[]}
