{"task_id": "T-44440", "status": "PASSED", "files_modified": [{"path": "backend/app/analytics_repository.py", "lines_added": 15, "lines_removed": 10}, {"path": "backend/app/analytics_router.py", "lines_added": 15, "lines_removed": 12}, {"path": "backend/app/membership_router.py", "lines_added": 8, "lines_removed": 8}], "diff_summary": "Resolve strict typing of known count rows and migrated analytics/membership handlers with runtime-neutral casts and explicit original response encoding.", "verification": {"command": "env APP_ENV=local PYTHONPATH=backend .venv/bin/pytest -q backend/tests/test_contract_snapshot.py backend/tests/test_analytics_router_serialization.py backend/tests/test_dashboard_next_event.py backend/tests/test_request_dependencies.py && .venv/bin/mypy --strict --follow-imports=silent backend/app/analytics_repository.py backend/app/analytics_router.py backend/app/membership_router.py && .venv/bin/ruff check backend/app backend/tests && .venv/bin/ruff format --check backend/app/analytics_repository.py backend/app/analytics_router.py backend/app/membership_router.py", "exit_code": 0, "tests_passed": 17, "tests_failed": 0, "duration_ms": 651}, "unresolved_blockers": []}
